{
  "$schema": "./openai-blueprint-run-manifest-v1.schema.json",
  "schema": "pixiecore.openai-blueprint-run-manifest/v1",
  "provider": "openai",
  "endpoint": "https://api.openai.com/v1",
  "model": "gpt-4.1-mini-2025-04-14",
  "release": "0.1.0",
  "pricing": {
    "currency": "USD",
    "input_per_million_tokens": 0.4,
    "output_per_million_tokens": 1.6,
    "source": "https://developers.openai.com/api/docs/pricing",
    "verified_at": "2026-08-26T00:00:00.000Z"
  },
  "data_policy": {
    "sensitivity": "synthetic",
    "remote_transmission": "allowed-after-explicit-confirmation",
    "artifact_values": "value-free-diagnostics-only"
  },
  "datasets": [
    {
      "id": "travel-document-fields",
      "role": "extractor",
      "path": "examples/blueprints/extractor/travel-document-fields/evaluations/travel-document-fields.yaml",
      "case_count": 7,
      "comparison_modes": ["exact", "fields"],
      "sensitivity": "synthetic",
      "attachments": [
        { "case_id": "native-text-pdf", "kind": "native-pdf", "path": "examples/blueprints/extractor/travel-document-fields/fixtures/native-text.pdf" },
        { "case_id": "scanned-pdf-partial", "kind": "scanned-pdf", "path": "examples/blueprints/extractor/travel-document-fields/fixtures/scanned.pdf" },
        { "case_id": "multi-page-evidence", "kind": "multi-page-pdf", "path": "examples/blueprints/extractor/travel-document-fields/fixtures/multi-page.pdf" },
        { "case_id": "rotated-page", "kind": "rotated-pdf", "path": "examples/blueprints/extractor/travel-document-fields/fixtures/rotated.pdf" },
        { "case_id": "blank-page-unreadable", "kind": "blank-pdf", "path": "examples/blueprints/extractor/travel-document-fields/fixtures/blank-page.pdf" },
        { "case_id": "table-layout", "kind": "table-pdf", "path": "examples/blueprints/extractor/travel-document-fields/fixtures/table.pdf" },
        { "case_id": "screenshot-image", "kind": "screenshot", "path": "examples/blueprints/extractor/travel-document-fields/fixtures/travel-request-screenshot.png" }
      ]
    },
    { "id": "travel-destination-level", "role": "classifier", "path": "examples/blueprints/classifier/travel-destination-level/evaluations/travel-destination-level.yaml", "case_count": 13, "comparison_modes": ["exact"], "sensitivity": "synthetic", "attachments": [] },
    { "id": "travel-request-summary", "role": "summarizer", "path": "examples/blueprints/summarizer/travel-request-summary/evaluations/travel-request-summary.yaml", "case_count": 8, "comparison_modes": ["custom"], "sensitivity": "synthetic", "attachments": [] },
    { "id": "travel-request-form", "role": "validator", "path": "examples/blueprints/validator/travel-request-form/evaluations/travel-request-form.yaml", "case_count": 9, "comparison_modes": ["exact"], "sensitivity": "synthetic", "attachments": [] },
    { "id": "travel-document-evidence", "role": "verifier", "path": "examples/blueprints/verifier/travel-document-evidence/evaluations/travel-document-evidence.yaml", "case_count": 8, "comparison_modes": ["exact"], "sensitivity": "synthetic", "attachments": [] },
    { "id": "date-normalizer", "role": "converter", "path": "examples/blueprints/converter/date-normalizer/evaluations/date-normalizer.yaml", "case_count": 10, "comparison_modes": ["exact"], "sensitivity": "synthetic", "attachments": [] },
    { "id": "travel-purpose-localizer", "role": "translator", "path": "examples/blueprints/translator/travel-purpose-localizer/evaluations/travel-purpose-localizer.yaml", "case_count": 8, "comparison_modes": ["exact"], "sensitivity": "synthetic", "attachments": [] },
    { "id": "travel-approval-routing", "role": "router", "path": "examples/blueprints/router/travel-approval-routing/evaluations/travel-approval-routing.yaml", "case_count": 8, "comparison_modes": ["exact"], "sensitivity": "synthetic", "attachments": [] }
  ],
  "phases": [
    { "id": "canary", "runs": 1, "dataset_ids": ["date-normalizer"], "case_ids": ["japanese-gregorian"], "max_calls": 1, "budget_usd": 0.05, "artifact_directory": "benchmarks/results/openai/canary" },
    { "id": "baseline", "runs": 1, "dataset_ids": ["travel-document-fields", "travel-destination-level", "travel-request-summary", "travel-request-form", "travel-document-evidence", "date-normalizer", "travel-purpose-localizer", "travel-approval-routing"], "max_calls": 71, "budget_usd": 2, "artifact_directory": "benchmarks/results/openai/baseline" },
    { "id": "repeated", "runs": 3, "dataset_ids": ["travel-document-fields", "travel-destination-level", "travel-request-summary", "travel-request-form", "travel-document-evidence", "date-normalizer", "travel-purpose-localizer", "travel-approval-routing"], "max_calls": 213, "budget_usd": 6, "artifact_directory": "benchmarks/results/openai/repeated" }
  ]
}
